{
  "player_uid": "pl_salah",
  "source_id": "fpl-official-endpoints",
  "source_player_id": "123",
  "season": "2025-26",
  "observed_at": "2026-07-21T12:00:00Z",
  "available_at": "2026-07-21T12:00:00Z",
  "published_at": "2026-07-21T12:00:00Z",
  "effective_at": "2026-07-21T12:00:00Z",
  "provenance": {
    "source_ids": [
      "fpl-official-endpoints"
    ],
    "transformation_version": "0.1.0",
    "ruleset_id": "2026-27-v0.1"
  }
}
